{
  "spec_version": "1.0",
  "term": {
    "acr": "Dragonfly",
    "full": "Dragonfly In-Memory Data Store"
  },
  "draft": {
    "engine": "ltx-desktop",
    "host": "windows-4090",
    "operator": "james",
    "drafted_at": "2026-09-18T16:11:03+00:00",
    "iterations": 0
  },
  "prompt": {
    "natural": "A glowing holographic dragonfly whose wings are spinning multi-core processor threads, routing millions of luminous data packets between memory cores at microsecond speed. TODO: add direction (camera arc, ending beat).",
    "h3_structured": {
      "subject": "TODO: holographic metaphor for Dragonfly - A glowing holographic dragonfly whose wings are spinning multi-core processor threads, routing millions of luminous data packets between memory cores at microsecond speed",
      "scene": "deep-navy cyberspace void (#0b0f1e) with faint grid horizon",
      "motion": "TODO: what moves, in what order, synced to beats",
      "camera": "TODO: overall camera arc (e.g. slow push-in wide to medium)",
      "lighting": "cyan and magenta rim glow, volumetric light shafts",
      "style": "holographic explainer art, deep-navy void #0b0f1e, cyan/magenta glow, no text, 16:9",
      "audio": "TODO: ambient bed + per-beat accents (H3 native stereo)"
    },
    "h3_text": "TODO: flatten h3_structured into the final H3 prompt text.",
    "negative": "text, captions, watermark, logos, distorted faces, flicker, low contrast"
  },
  "keyframes": [
    {
      "role": "first",
      "source": "images/lexi/Dragonfly.jpg",
      "note": "Track A concept image as first frame (FL2VA I2V)."
    }
  ],
  "h3_checkpoint": "FL2VA",
  "duration_s": 12.0,
  "fps": 24,
  "beats": [
    {
      "beat": 1,
      "title": "AI Swarm Request",
      "desc": "80 agents simultaneously request real-time session tokens.",
      "camera": "TODO: camera move for this beat",
      "motion": "TODO: subject/scene motion for this beat",
      "time_range_s": [
        0.0,
        3.0
      ]
    },
    {
      "beat": 2,
      "title": "Dragonfly Core",
      "desc": "Multi-threaded C++ engine processes across all 64 CPU cores.",
      "camera": "TODO: camera move for this beat",
      "motion": "TODO: subject/scene motion for this beat",
      "time_range_s": [
        3.0,
        6.0
      ],
      "active": true
    },
    {
      "beat": 3,
      "title": "Microsecond Read",
      "desc": "Data returned in under 200 microseconds with zero queue lock.",
      "camera": "TODO: camera move for this beat",
      "motion": "TODO: subject/scene motion for this beat",
      "time_range_s": [
        6.0,
        9.0
      ]
    },
    {
      "beat": 4,
      "title": "Instant AI Response",
      "desc": "User receives real-time agent output with zero perceptible lag.",
      "camera": "TODO: camera move for this beat",
      "motion": "TODO: subject/scene motion for this beat",
      "time_range_s": [
        9.0,
        12.0
      ]
    }
  ],
  "resolution": {
    "native": "768p",
    "target": "720p",
    "upscale": {
      "method": "none"
    }
  },
  "seed": null,
  "audio": {
    "native_stereo": true
  },
  "encode": {
    "codec": "h265",
    "container": "mp4",
    "max_mb": 15
  },
  "output": {
    "r2_bucket": "vidismart",
    "r2_key": "videos/lexi/Dragonfly.mp4",
    "cdn_url": "https://cdn.vidi.news/videos/lexi/Dragonfly.mp4"
  },
  "quality": "standard",
  "approval": {
    "status": "pending"
  },
  "render": {
    "engine": "h3-local-miami",
    "queue": "lex:h3:render",
    "attempts": 0,
    "last_error": null
  },
  "review": {}
}