{
  "spec_version": "1.0",
  "term": { "acr": "CRM", "full": "Customer Relationship Management" },
  "draft": {
    "engine": "ltx-desktop",
    "host": "windows-4090",
    "operator": "james",
    "preview_local_path": "C:/Users/James/Videos/ltx-desktop/CRM-draft-07.mp4",
    "drafted_at": "2026-09-18T15:40:00Z",
    "iterations": 7
  },
  "prompt": {
    "natural": "Holographic digital address book and glowing neural sales funnel routing customer relationships into closed deals. Slow cinematic push-in ending on a golden Closed-Won ledger burst.",
    "h3_structured": {
      "subject": "A holographic digital address book floating beside a glowing neural sales funnel; luminous customer cards flow into the funnel and emerge as sealed golden deals",
      "scene": "Deep-navy cyberspace void (#0b0f1e) with faint grid horizon, floating UI panels of a sales pipeline",
      "motion": "Customer cards lift off the address book pages one by one, stream along glowing neural paths into the funnel, pulse at the deal-stage gate, then a golden burst as the deal closes",
      "camera": "Slow cinematic push-in from wide establishing to medium on the funnel mouth, finishing with a gentle rise as the golden burst fills frame",
      "lighting": "Cyan and magenta rim glow, volumetric light shafts through the funnel, warm gold accent only at the close-won burst",
      "style": "Holographic explainer art, sleek futuristic HUD aesthetic, no text, 16:9",
      "audio": "Soft ambient synth pad, subtle data-chime as each card enters the funnel, warm resolving chord on the golden burst"
    },
    "h3_text": "Subject: a holographic digital address book floating beside a glowing neural sales funnel; luminous customer cards flow into the funnel and emerge as sealed golden deals. Scene: deep-navy cyberspace void with faint grid horizon and floating pipeline UI panels. Motion: cards lift off the pages, stream along glowing neural paths into the funnel, pulse at the stage gate, golden burst as the deal closes. Camera: slow cinematic push-in from wide to medium on the funnel mouth, gentle rise at the end. Lighting: cyan and magenta rim glow, volumetric shafts, warm gold accent at the burst. Style: holographic explainer art, sleek futuristic HUD, no text, 16:9. Audio: ambient synth pad, data-chimes per card, warm resolving chord on the burst.",
    "negative": "text, captions, watermark, logos, distorted faces, flicker, low contrast"
  },
  "keyframes": [
    { "role": "first", "source": "images/lexi/CRM.jpg", "note": "Track A concept image as first frame (FL2VA I2V)." }
  ],
  "h3_checkpoint": "FL2VA",
  "duration_s": 12,
  "fps": 24,
  "beats": [
    { "beat": 1, "title": "Lead Inbound", "desc": "Web forms, calls, trade shows capture prospect data.", "camera": "wide establishing, slow drift right", "motion": "customer cards materialize above the address book", "time_range_s": [0, 3] },
    { "beat": 2, "title": "CRM Hub (HubSpot/SF)", "desc": "Deal pipeline updates, automated email sequences trigger.", "camera": "push-in toward funnel mouth", "motion": "cards stream along neural paths into the funnel, stage gate pulses", "time_range_s": [3, 7], "active": true },
    { "beat": 3, "title": "Rep Engagement", "desc": "Sales rep calls with complete history on one screen.", "camera": "steady medium, slight orbit left", "motion": "funnel walls light up with history panels", "time_range_s": [7, 10] },
    { "beat": 4, "title": "Closed Won $$", "desc": "Order syncs to ERP, billing invoice generates.", "camera": "gentle rise as burst fills frame", "motion": "golden burst, sealed deal emblem rises", "time_range_s": [10, 12] }
  ],
  "resolution": {
    "native": "768p",
    "target": "1080p",
    "upscale": { "method": "esrgan", "note": "DAT if ESRGAN artifacts on glow edges." }
  },
  "seed": 20260918,
  "audio": { "native_stereo": true },
  "encode": { "codec": "h265", "container": "mp4", "max_mb": 15 },
  "output": {
    "r2_bucket": "vidismart",
    "r2_key": "videos/lexi/CRM.mp4",
    "cdn_url": "https://cdn.vidi.news/videos/lexi/CRM.mp4"
  },
  "quality": "premium",
  "approval": { "status": "pending" },
  "render": { "engine": "h3-local-miami", "queue": "lex:h3:render", "attempts": 0, "last_error": null },
  "review": {}
}
